to;from;sim;source
Запряги-ка лошадь да скажи Размётнову, чтобы заехал за мной.;Дэ-ка андрэ грэс тэ пхэн Размётновонэскэ, собы загыя пал мандэ.;0.864509105682373;brigada
Я буду на квартире.;Мэ явава кэ пэ дрэ штуба.;0.7136540412902832;brigada
— Может, мне бы со своими перекинуться на целину, подсобить Любишкину? — предложил было Демка, но Давыдов чертыхнулся, крикнул: — Выдумываешь!;На явэла ли фэдыр и мангэ пэскирэнца тэ пиричюрдавпэ прэ Цэлина, тэ помогискирав Любишкиноскэ? — пхэндя Дёмка, нэ Давыдово выкостяпэ бэнгэса, задыя годла: — Инке со!;0.74181067943573;brigada
Они сами должны управиться!;Ёнэ кокорэ бангэ тэ управинэнпэ!;0.7535573840141296;brigada
Вот поеду, наломаю им хвосты, тогда они у меня, факт, что не будут по половине… пахать!;Окэ джява, пхагирава лэнгэ о порья, отэнчя ёнэ мандэ, чячё, со на лэна пиро пашори... тэ пахинэн Дэ андрэ!;0.7919384837150574;brigada
Запрягай! Размётнов подъехал к квартире Давыдова на одном из правленческих жеребцов, запряженном в дрожки.;"Прэ екхэ правленческонэ кхурэндыр; саво сыс задыно андрэ дро дрожки Размётново подыя ко Давыдовонэскири штуба.";0.6776713132858276;brigada
Давыдов уже ожидал, стоял возле ворот, прижав локтем небольшой узелок.;Давыдовоужэ дужакирдя ёв сыс тэрдо пало удэры, при тасави локтёса набаро комбицо.;0.5516113042831421;brigada
— Садись.;— Бэш!;0.6465897560119629;brigada
Ты чего это, харчей набрал, что ли? — улыбнулся Размётнов.;Ту со адава, хабэ закэдыян со ли? — засандяпэ Размётново.;0.898201584815979;brigada
— Белье.;— Гада...;0.6913619041442871;brigada
— Какое белье?;— Савэ гада?;0.8206719756126404;brigada
Зачем?;Палсо?;0.7990903854370117;brigada
— Ну, смена белья.;— Нэ, тэ пирипарував о гада.;0.787323534488678;brigada
— На что это?;— Прэ со адава?;0.9685388803482056;brigada
— Да езжай ты, чего пристал?;— Нэ джя уж ту, со приячьян?;0.908329427242279;brigada
Белье взял затем, чтобы вшей не разводить, понятно?;Гада лыём палодова, собы о джюва тэ на розлыджяв, полыян?;0.7415307760238647;brigada
Еду в бригаду, ну, вот и решил до тех пор там побыть, пока кончат пахоту.;Джява дрэ бригада, нэ, окэ и ячязапэ одой жыко одоя пора, коли саро спахинэна.;0.6736515760421753;brigada
Закрой рот и трогай.;Нэ на порав о муй, традэ.;0.25827428698539734;brigada
— Ты, бывает, умом не рухнулся?;— А ту годятыр на згыян?;0.6880379319190979;brigada
Что ты там будешь делать до конца пахоты?;Со ту одой лэса тэ кэрэс жыко одоя пора?;0.7774268984794617;brigada
— Пахать.;— Тэ пахинав.;0.8478333353996277;brigada
— Бросишь правление и поедешь пахать?;— Чюрдэса правлениё и джяса тэ пахинэс?;0.8997147083282471;brigada
Ну, вот это придумал!;Нэ, окэ адава придуминдян!;0.9123935103416443;brigada
— Езжай!;— Традэ!;0.9478766322135925;brigada
Езжай!;Традэ!;0.8787291049957275;brigada
— Давыдов сморщился.;— Давыдово сморшшиндяпэ.;0.9265013933181763;brigada
— Да ты не сепети!;— Тэ ту накова!;0.8759139776229858;brigada
— Размётнов, как видно, начинал злиться.;— Размётаново, ґалёв лыя тэ холясол.;0.8262078762054443;brigada
— Ты мне путем объясни: без тебя там не обойдутся, или как?;— Ту мангэ шукаринькэс роспхэн: би тыро одой на обджянапэ, или инке со?;0.890082597732544;brigada
Ты должен руководить, а не за плугом ходить!;Ту банго тэ тэрдёс прэ лыджяибнытко буты, а на пало плуго тэ псирэс!;0.6673319339752197;brigada
Ты — председатель колхоза…;Ту — колхозоскиро председателё...;0.9565836191177368;brigada
Давыдов яростно сверкнул глазами: — Ну, еще!..;Давыдово холямэс чюрдыя якхэнца. — Нэ, инке!..;0.8086819052696228;brigada
Учишь!..;Сыклякирэса!..;0.9296819567680359;brigada
Я сначала — коммунист, а потом уж… факт!.. а потом уж председатель колхоза!;Мэ англыдыр сарэстыр — комунисто, а отэнчя ужэ... чячё! А отэнчя ужэ колхозоскиро председателё.;0.8537667989730835;brigada
У меня пахота гибнет, а я тут буду?..;Мандэ пахота хасёла, а мэ адай явава?;0.8369219899177551;brigada
Пошел, пошел, говорят тебе!..;Джя, джя, ракирна тукэ!..;0.8405848741531372;brigada
— Да мне-то что!;— Тэ мангэ то со!..;0.7859520316123962;brigada
Но, ты, уснул, вражина!;Нэ ту, засутян, бэнг!;0.8786754012107849;brigada
— Размётнов вытянул кнутом жеребца.;Размётново вытырдыя чюпняса кхурэс.;0.7505223751068115;brigada
"Давыдов от неожиданного рывка откинулся назад, больно ударился локтем о дрожину; колеса мягко затарахтели по летнику[50] в степь.";"Давыдовонэс отчюрдыя палэ, ёв зоралэс мэладяпэ локтёса дро урдэн; роты ковлэс прастандынэ пиро дром дрэ фэлда.";0.770919144153595;brigada
На выезде из хутора Размётнов перевел жеребца на шаг, вытер рукавом шрамистый лоб.;Коли лынэ тэ выджян гавэстыр, Размётново пирилыджия кхурэс про шаго, выкхостя баяса чэкат.;0.8551771640777588;brigada
— Ты, Давыдов, глупость сотворяешь!;— Ту, Давыдово, дылныпэ кэрэса!;0.9394516348838806;brigada
Ты им работу поставь на ноги и мотай назад.;Ту лэнгэ буты тхов про ґэра, а кокоро палэ.;0.618789553642273;brigada
Это, брат, не диво, пахать-то.;Адава, пшала, нанэ баро рэндо, тэ пахинэс-то.;0.7493170499801636;brigada
Хороший командир не должен в цепе идтить, а должен умно командовать, вот что я тебе скажу!;Лачё командиро нанэ банго дрэ цэпь тэ джял, а банго годьварэс тэ лыджял сарэса, окэ со мэ тукэ пхэнава!;0.8094334006309509;brigada
— Оставь, пожалуйста, свои примеры!;— Ачяв ту адалэ лава!;0.5379125475883484;brigada
Я должен их научить работать и научу, факт!;Мэ банго лэн тэ высыклякирав тэ бутякирэн и высыклякирава, чяче!;0.7836914658546448;brigada
Это и есть руководство!;Адава и сы лыджяибэ!;0.7913354635238647;brigada
В первой и третьей бригаде кончили колосовые, а тут у меня прорыв, Любишкин не справится, как видно. А ты еще туда же: «Хороший командир» и прочее…;Дрэ пэрво и трито бригада закончиндлэ колкосова, а адай мандэ прорискирибэ, Любишкиноскэ ґалёв тэ на справинпэ А ту инке одорик жэ: «Лачё командиро» тэ инке...;0.8495489954948425;brigada
Ну, чего ты мне очки втираешь? Что я, не видал хороших командиров, по-твоему?;Нэ со ту мангэ ракирэса? со мэ на дыкхьём лаче командирэн, думинэса?;0.838747501373291;brigada
Тот и хорош, который в заминке своим примером ведет. И я должен повести!;Одова и лачё, саво долыджяла рэндо жыко концо! и мэ банго адякэ тэ кэрав!;0.784212052822113;brigada
— Ты бы им лучше два букаря перекинул из первой бригады.;— Ту бы лэнгэ фэдыр дуй урдэна пиричюрдыян пэрвонэ бригадатыр.;0.879399836063385;brigada
— А людей?;— А манушэн?;0.957053005695343;brigada
Людей где возьму?;Манушэн кай лава?;0.8654517531394958;brigada
Погоняй, погоняй, пожалуйста!;Нэ традэ, традэ мэ тут мангава!;0.5487931370735168;brigada
До самого гребня ехали молча.;Жыко само канґлы ни лав ни паш на проракирдэ.;0.15562480688095093;brigada
Над степью, заслонив солнце, в зените стояла вздыбленная ветром, густолиловая градовая туча.;Про болыбэ, закэри пэса кхам, саво сыс тэрдо дрэван учес, ґаздымэ балваляса тэрды сыс гэнсто-лилово градово тучя.;0.681270956993103;brigada
Белые обочины ее клубились и снежно блистали, но черная вершина была грозна своей тяжкой недвижностью.;Парнэ пашварэ лакирэ клубиндлэпэ и сыр ив блестиндлэ, нэ упрал ёй сыс калы и трашаны.;0.6337312459945679;brigada
Из провала тучи, из-за оранжевого, окрашенного солнцем края широким веером косо ниспадали солнечные лучи.;Тучякирэ провалостыр, оранжэвонэ, окрасимэ кхамэса краёстыр буґлэ веероса на прямэс пэрнас кхамэскирэ лучи.;0.5741902589797974;brigada
Тонкие, копьеносные там, в просторном небе, они потоками расходились, приближаясь к земле, и, ложась на дальние, простертые над горизонтом грядины бурой степи, красили ее, диковинно и радостно молодили…;Санэ копьеносна, одой, дро буґло болыбэ ёнэ розджянаспэ, подгыи кэ пхув, пасинэ про дуратунэ, пашыл горизонто бура фэлдакирэ грядины, красиндлэ ла, тэрнякирдэ...;0.7063279151916504;brigada
Степь, задымленная тучевой тенью, молчаливо, покорно ждала дождя.;Фэлда, покалымэ тучятыр, тихэс дужакирдя брышынд.;0.46798175573349;brigada
Ветер кружил на шляху сизый столб пыли.;Балвал крэнцындя пиро дром прахо.;0.6775718927383423;brigada
Ветер уже дышал духовитой дождевой влагой. А через минуту, скупой и редкий, пошел дождь.;Дро балвал ужэ сыс миштэс кхандыпнытко брышындытко киндыпэ, а пирдал мэнта скэмпо и на чясто, гыя бришынд.;0.49240463972091675;brigada
Ядреные холодные капли вонзались в дорожную пыль, сворачивались в крохотные комочки грязи.;Барэ шылалэ капли упинэпэ дро дромитко прахо ачнэ тыкниньконэ блатакирэ котэрорэнца.;0.5826098918914795;brigada
Тревожно засвистали суслики, отчетливей зазвучал перепелиный бой, умолк накаленный страстью призывный крик стрепета.;Трашаибнаса дрэ глос лынэ тэ дэн шоля сусликэ, фэдыр шундло ачья перепёлэнгиро марибэ, замулыя прикхарибнытко стрепетоскири годла.;0.6280499696731567;brigada
По просяной стерне хлынул низовой ветер, и стерня ощетинилась, зашуршала.;Пиро просяно стерня (пхус, саво ачьяпэ про корнё) дыя тэлыпнытко балвал, и ёй ґаздыяпэ, зашуршындя.;0.39354848861694336;brigada
Степь наполнилась сухим ропотом прошлогодних бурьянов.;Дрэ фэлда заракирдэ шукэс одо бэршытка бурьяны.;0.676322340965271;brigada
Под самой тучевой подошвой, кренясь, ловя распростертыми крылами воздушную струю, плыл на восток ворон.;Тэлэ само тучя, плывиндя про востоко корако, и ухтылдя розмэклэ крылэнца фанытко струя.;0.6333658695220947;brigada
Бело вспыхнула молния, и ворон, уронив горловой баритонистый клекот, вдруг стремительно ринулся вниз.;Сыкадыя парны блесковица, корако радя кирлытко годла и екхатыр сыр бар чырдыяпэ тэлэ.;0.6274817585945129;brigada
"На секунду — весь осиянный солнечным лучом — он сверкнул, как охваченный полымем смоляной факел; слышно было, как сквозь оперенье его крыл со свистом и буреподобным гулом рвется воздух, но, не долетев до земли саженей полсотни, ворон круто выпрямился, замахал крыльями, и тотчас же с оглушительным, сухим треском ударил гром.";"Прэ мэнта — обчидо кхамитконэ лучёса — ёв засверкиндя, сыр обухтылдо ягаса смоляно факело; шундло сыс сыр пирдал лэскирэ пора про крылы шоленца рикирлапэ фано, нэ, на доурняндыя жыко пхув сыр пашшэл сажэни, корако вытырдыяпэ саро, замардя крылэнца, и екхатыр жэ шукэ трескоса дыя громо.";0.7948630452156067;brigada
На гребне показался стан второй бригады, когда Размётнов заприметил шагавшего под изволок, навстречу им человека.;Прэ канґлы сыкадыя вавр бригадакиро Стано, коли Размётново удыкхья манушэс, саво гыя прэ лэндэ.;0.8202852010726929;brigada
Он шел бездорожно, перепрыгивая ярки, иногда переходя на старческую дробную рысь. Размётнов направил к нему жеребца и еще издали угадал деда Щукаря.;Ёв гыя на пиро дром, пириухтя тыкнинька оврагицы, а вавир моло и мэкэласпэ тэ прастал, кэ прастандыя ёв на тэрнэс, Размётново мэкья кэ ёв кхурэс и инке дурал уґалыя пхурэ Шшукарёс.;0.6560621857643127;brigada
По всему было видно, что со Щукарем произошло что-то неладное…;Пир саро сыс дыкхно со Шшукарёса кэрдяпэ варисо-то намишто...;0.7957683801651001;brigada
Он подошел к дрожкам.;Ёв подгыя ко дрожки.;0.9304104447364807;brigada
Волосы на обнаженной голове его были плотно прибиты дождем, в мокрой бороденке, в бровях густо торчало разваренное пшено. Щукарь был иссиня-бледен, напуган, и у Давыдова ворохнулась тяжкая догадка: «В бригаде неладно… Волынка!»;Би стадякиро, бала лэскирэ сыс плотнэс примардэ бришындэса, дро киндэ бэдэ чёра, дро брови гэнстэс торчиндя розкэрады кхурмы Шшукарё адякэ кэрдяпэ парно, со дажэ синё, пиритрашадо, и Давыдовонэстэ дро шэро екхатыр: «Дрэ бригада варисо-то на адякэ...»;0.6183062195777893;brigada
— В чем дело? — спросил он.;— Дрэ со рэндо? — пучья ёв.;0.8826910853385925;brigada
— От смерти насилу ушел! — выдохнул Щукарь.;— На джином кокоро сыр и угыём мулыпнастыр! — дыя ґондя Шшукарё.;0.6153565645217896;brigada
— Убить хотели…;— Тэ умарэн камлэ...;0.7540861964225769;brigada
— Кто?;— Кон?;0.9328135251998901;brigada
— Любишкин и протчие.;— Любишкино и ваврэ.;0.9524662494659424;brigada
— За что?;— Палсо?;0.8729262351989746;brigada
— За капрызность ихнюю…;— Пало дылныпэ лэнгиро...;0.7589714527130127;brigada
За кашу дело зашло…;Палэ кхурми рэндо загыя...;0.7107168436050415;brigada
Я человек отчаянный на слова, не стерпел… ну, а Любишкин ухватил нож, да за мной…;Мэ — мануш надарипнытко и хачкирдо прэ ада лава, на урикирдёмпэ... нэ, а Любишкино ухтылдя чюри, тэ пал мандэ... тэ коли бы на мирэ сыга ґэра — бэшавас бы мэ акана прэ чюри!;0.7629905939102173;brigada
Кабы не моя резвость — сидел бы зараз я на ноже!;Адякэ и спэтёвавас бы!..;0.19870591163635254;brigada
Так и спекся бы!..;— Джя дро гав, отэнчя роскэдасапэ, — припхэндя Давыдово, и локхэс дыя ґондя.;0.02281941846013069;brigada
— Ступай в хутор, после разберемся, — приказал Давыдов, облегченно вздыхая. …А на стану за полчаса до этого произошло следующее: дед Щукарь, пересолив накануне кашу, решил выдобриться перед бригадой и, отправившись с вечера в хутор, переночевал там, а утром припас из дому мешок, на пути в бригаду завернул к гумну Краснокутова, жившего на самом краю хутора, перелез через прясло и воровски затаился возле мякинной кучи.;А про стано паш мардо одолэскэ палэ выгыя окэ со: пхуро Шшукарё атася пирилондькирдя кхурми и палодова камья сыр то тэ замакхэл пэскиро бангипэ ангил бригада. Ёв гыя бельвелятыр дро гав, пирираткирдя одой, а злокоса лыя кхэрэстыр гоно, и гыи дрэ бригада зрискирдя ко Краснокутовонэскири гувна, сави сыс про само гавэскиро краё, пиригыя пирдал прясло и чёраханэс затарадыя пашыл шприякари (мякинакири) кучя.;0.4691409170627594;brigada
План у деда Щукаря был гениально прост: подстеречь курицу, осторожно схватить ее и обезглавить, чтобы наварить каши с курятиной и тем самым снискать себе в бригаде почет и уважение.;Плано пхурэ Шшукарёстэ сыс энокэ саво: тэ подракхэс каґня, потихинькэс тэ ухтылэс ла и тэ отрискирэс шэро, ваш адава собы тэ кэравас кхурми прэ каґнятэ и одолэса тэ поддэспэ кэ бригада.;0.6961770057678223;brigada
Он пролежал, тая дыхание, с полчаса, но куры, как назло, рылись где-то около плетня, а подходить к вороху мякины словно и не думали.;Ёв пропасия, ґалёв паш мардо дари тэ дэл ґондя, нэ каґня сыр прэ холы псирдэ кай-то пашыл плетнё, и ґалёв на думиндлэ тэ поджян кэ шприя.;0.6911358833312988;brigada
Тогда дед Щукарь начал тихохонько их прикликать: «Цып, цып, цып, цып!..;Отэнчя пхуро Шшукарёлыя потихинькэс тэ скхарэл лэн: «Цып, цып, цып, цып!..;0.7654842138290405;brigada
Цыпаньки!;Цыпыньки!;0.9927574396133423;brigada
Мамушки!;Мрэ даёрья!;0.6594400405883789;brigada
Тю-тю-тю!» — звал он шепотом, а сам звероподобно таился за мякиной.;Цып, цып, цып!» кхардя ёв тихэс, а кокоро сыр рув гарадыя палэ шприя.;0.8466500043869019;brigada
Старик Краснокутов случайно находился неподалеку от гумна.;Пхуро Краснокутово сыс на дур гувнатыр.;0.6949580907821655;brigada
Он услышал чей-то вкрадчивый голосок, созывавший кур, присел за плетнем…;Ёв ушундя конэскири-то чёраханы глосори, сави скхардя каґнен, прибэстя пало плетнё...;0.770544707775116;brigada
Куры доверчиво подошли к вороху мякины, и в этот момент Краснокутов увидел, как чья-то рука, высунувшись из мякины, сцапала бисерную курочку за ногу.;Каґня надари подгынэ кэ шприя, и окэ адай то Краснокутово удыкхья, сыр конэскиро то васт, згарадо палэ шприя, ухтылдя бисернонэ каґнорья палэ ґэрой.;0.8098415732383728;brigada
Щукарь задушил курицу с быстротой матерого хоря и только что начал просовывать ее в мешок, как услышал негромкий вопрос: «Курочек щупаешь?» — и увидел поднимавшегося из-за плетня Краснокутова.;Шшукарё затасадя каґня сыго, сыр зорало хорё и только со лыя тэ тховэл ла дро гоно, сыр ушундя пучибэ: «Каґнорьен шшупинэса? и удыкхья сыр палэ плетнёстыр ґаздыяпэ Краснокутово.;0.7387830018997192;brigada
