to;from;sim;source
Так растерялся дед Щукарь, что выронил из рук мешок, снял шапку и некстати поздоровался: «Доброго здоровья, Афанасий Петрович!»;"Шшукарё на джиндя со тэ кэрэл; вырадя вастэндыр гно, злыя стады и палсо-то кэрдя шэро: «Тэ явэс джидо, Афанасиё Петровичё!»";0.751849353313446;brigada
— «Слава богу, — отвечал тот.;Яв джидо, — пхэндя одова.;0.4454198181629181;brigada
— Курочками, говорю, займаешься?»;— Каґнорьенца, ракирава, залэсапэ?»;0.8199735283851624;brigada
— «Вот-вот!;— «Окэ-окэ!;0.9610907435417175;brigada
Иду мимо и вижу — бисерная курица!;Джява мамуй и дыкхава: бисерно кагны!;0.756247341632843;brigada
Такая по ней диковинная разноцветь пера, что даже не мог я утерпеть.;Адасавэ прэ латэ гожа пора, со на могискирдём мэ адякэ тэ проджяв.;0.7352334856987;brigada
Дай, думаю, поймаю, погляжу вблизу, что это за диковинная птаха?;Дэ, думинава, ухтылава, подыкхава пашылыдыр, со адава за чирикло адасаво?;0.8168573379516602;brigada
Век прожил, а такой любопытственной не видывал!»;Вэко проджиндём а адасавэ каґня инке на дыкхьём!».;0.8148779273033142;brigada
Щукарева хитрость была прямо-таки неуместна, и Краснокутов положил ей конец: «Не бреши, старый мерин!;Шшукарёскиро фрэнтыма на сыс трэби, и о Краснокутово пририскирдя лэс. «На хохав, пхуро кхуро!;0.8047938942909241;brigada
Курей в мешках не разглядывают!;Каґнен дро гоно на роздыкхэна!;0.7726405262947083;brigada
Признавайся: на какую надобность хотел скрасть?»;Ракир ваш со камьянтэ чёрэе?;0.3229042589664459;brigada
И Щукарь повинился: сказал, что хотел угостить пахарей своей бригады кашей с курятиной.;И Шшукарё приґалыяпэ: пхэндя, со камья тэ кэравэл кхурми прэ каґнятэ ваш пэскири бригада.;0.8405108451843262;brigada
К его удивлению, Краснокутов и слова не сказал суперечь, а только посоветовал: «Пахарям можно, в этом греху нету.;Ёв дрэван удивисалыя, со Краснокутово на лыя бутыр лэс тэ кошэл, а только пхэндя: «Ваш пахаренгэ — адава ничи.;0.7544138431549072;brigada
Раз уж ты пошкодил одну курочку, то клади ее в мешок, да вдобавки подстрели костыликом ишо одну, да не эту, а вот энту, какая не несется, хохлатую…;Коли уж ту ухтылдян екхэ каґнорья, тхов ла дро гоно, тэ откырэнцынэ о шэро инке екхакэ, тэ на одола, а энокэ адалэ каґнорья, сави на лыджяла о парнорэ, энокэ хохлатона...;0.8002356290817261;brigada
Из одной курицы на бригаду лапши не сваришь.;Екхэ каґнятыр прэ сари бриґада на кэравэса кхурми.;0.7007469534873962;brigada
Лови другую скорей и метись живее, а то — не дай бог — старуха моя вспопашится, так нам с тобой обоим тошноты наделает!»;Ухтыл вавря сыгыдыр, тэ джя адатхыр, а то — на дэ дэвла — пхуромны мири уґалёла, отэнчя дорэсэлапэ сарэ дуенгэ!».;0.7961466312408447;brigada
Щукарь, донельзя довольный исходом дела, поймал вторую курицу и махнул через прясло.;Шшукарё дрэван обрадысалыя, сосаро адякэ обгыяпэ, ухтылдя вварэ каґня и пирдал прясло.;0.5936538577079773;brigada
За два часа он пришел на стан, а к приезду Любишкина из хутора у него уже кипела в трехведерном котле вода, выпрыгивало разварившееся пшено, и порезанная на куски курятина истекала наваристым жиром.;Пало дуй мардэ ёв явья про стано, а коли явья Любишкино гавэстыр, лэстэ ужэ кипиндя дро тринэвэдрытко пири паны, выухтя роскэрады кхурми, и розчиндло про котэра каґнякиро мас обчидяпэ тхулыпнаса.;0.8404332399368286;brigada
Каша удалась на славу.;Кхурми выгыя лачн.;0.600910484790802;brigada
Единственно, чего опасался дед Щукарь, — это того, что каша будет приванивать стоялой водой, так как воду черпал он в ближнем мелководном пруду, а непроточная вода там уже крылась чуть приметной зеленью.;Екх, состыр дарандыя пхуро Шшукарё, — адава одолэстыр, со кхурми лэла тэ прикхандэл тэрдыбнытконэ панеса, адякэ сыр паны ёв пхэрдя дро пашылатуно нахор прудо, а напротхадыбнытко паны одой ужэ лыя тэ учякирпэ зэлэнымаса.;0.6237418055534363;brigada
Но опасения его не оправдались: все ели и усердно хвалили, а сам бригадир Любишкин даже сказал: «В жизни не ел такого кондёра!;Нэ трашаибэ лэскиро прогыя: сарэ ханэ и зоралэс шардэ, а кокоро бригадир Любишкино пхэндя: «Пэрво моло дро саро пэскиро джиибэ хава адасави ґодина!;0.8092963695526123;brigada
Благодарность тебе, дедок, от всей бригады!»;Наиста тукэ, папулэ, сарэ бригадатыр!»;0.8165923357009888;brigada
Котел быстренько опорожнили.;Сыго дрэ пири ужэ ничи на ачьяпэ.;0.1510535627603531;brigada
Самые проворные уже начали доставать со дна гущу и куски мяса.;И одолэ, кон сыго хая, ужэ лынэ тэ дорэсэн тэлыпнастыр гэнстыма и котэра мас.;0.38616499304771423;brigada
В этот-то момент и случилось то, что навек испортило поварскую карьеру Щукаря…;Дрэ адая то мэнта и кэрдяпэ одова, со прэ саро джиибэ оттрадыя Шшукарёс кэраибнастыр...;0.797514796257019;brigada
Любишкин вытащил кусочек мясца, понес его было ко рту, но вдруг отшатнулся и побледнел.;Любишкино вытырдыя котэроро мас, подлыджия лэс ко муй, нэ екхатыр дыяпэ дрэ строна ада котэрэстыр и попарныя.;0.8706778287887573;brigada
— Это что же такое? — зловеще спросил он у Щукаря, поднимая кончиками пальцев кусок белого разваренного мяса.;— Со жэ адава адасаво? — холямэ глосяса пучья ёв Шшукарёстэ, ґаздыи ангуштэнгирэ концэнца котэр парно розкэрадо мас.;0.7781920433044434;brigada
— Должно, крылушко, — спокойно ответил дед Щукарь.;— Галёв, крылыцо на трашадёв — пхэндя пхуро Шшукарё.;0.7059661149978638;brigada
Лицо Любишкина медленно наливалось синеватым румянцем страшного гнева.;Лыбишкиноскиро муй понабут калыя холятыр.;0.6103775501251221;brigada
— Кры-луш-ко?..;— Кры-лы-цо?;0.8576273918151855;brigada
А ну, гляди сюда, каш-ше-варррр! — зарычал он.;А нэ ка, дыкх адарик каш-шэ-варрро! — рычянэс загодлалыя Любишкино.;0.7221491932868958;brigada
— Ох, милушки мои! — ахнула одна из баб.;— Ох, роднинька мирэ! — задыя годла сави-то джювлы.;0.8360980153083801;brigada
— Да на ней когти!..;— Тэ прэ латэ о ная!..;0.8722565770149231;brigada
— Повылазило тебе, окаянная! — обрушился на бабу дед Щукарь.;— Годятыр тут вымардя, бэнгланы! — дыяпэ прэ джювлятэ пхуро Шшукарё.;0.7941032648086548;brigada
— Откуда на крыле когти?;— Катыр адава про крылы ная?;0.8380963206291199;brigada
Ты под юбкой на себе их поищи!;Ту тэлэ индарака прэ пэстэ лэн породэ!;0.8529354929924011;brigada
Он кинул на разостланное ряднище ложку, всмотрелся: в подрагивающей руке Любишкина болталась хрупкая косточка, оперенная на конце перепонками и крохотными коготками…;Ёв чюрдыя прэ розчюды цэрга рой, вдыкхьяпэ: дро Любишкиноскиро васт, саво тринскирдяпэ, болтындяпэ санинько кокалыцо про концо перепонкэнца и тыкниньконэ наенца...;0.7801747918128967;brigada
— Братцы! — воскликнул потрясенный Аким Бесхлебнов. — А ить мы лягушку съели!..;— Пшалорэ! — задыя годла Акимо Бесхлебново, Тэ амэ жэ э жамба схаям!..;0.8724471926689148;brigada
Вот тут-то и началось смятение чувств: одна из брезгливых бабенок со стоном вскочила и, зажимая ладонями рот, скрылась за полевой будкой.;Нэ окэ адай то и розхачияпэ саро: екх гаджёри годласа сухтя, и закэри жмэненца ушта, гарадыя палэ фэлдытко будка.;0.6973035335540771;brigada
Кондрат Майданников, глянув на вылупленные в величайшем изумлении глаза деда Щукаря, упал на спину, покатываясь со смеху, насилу выкрикнул: «Ой, бабочки!;Кондрато Майданниково, вздыкхи про выпорадэ пхурэ Шшукарёскирэ якха, пыя про думо, катындяпэ сабнастыр, только и могискирдя тэ задэл годлы: «хасинэ, ромнорья!;0.7935870289802551;brigada
Оскоромилися вы!»;Оскороминдлэпэ тумэ!»;0.8524285554885864;brigada
Казаки, отличавшиеся меньшей брезгливостью, поддержали его.;Казаки, савэ на кя брезгиндлэ, подрикирдэ лэс.;0.8014847636222839;brigada
«Не видать вам теперича причастия!» — в притворном ужасе закричал Куженков.;«Тэ на дыкхэн акана тумэнгэ дэвлэскири причясть!» — хай трашадэ глосяса задыя годла Кужэнково.;0.8742517828941345;brigada
Но Аким Бесхлебнов, возмущенный смехом, свирепо заорал: «Какой тут могет быть смех?!;Нэ Акимо Бесхлебново, холясымэ сарэ адалэ собнастыр, холямэс загодлалыя: «Саво адай сабэ!?;0.8625165224075317;brigada
Бить Щукарячью породу!..»;Мар Шшукарячьё порода!..»;0.8455688953399658;brigada
— Откель могла лягушка в котел попасть? — допытывался Любишкин.;— Катыр попыя жамба дрэ пири? — доґалыяпэ Любишкино.;0.8093351721763611;brigada
— Да ить он воду в пруду черпал, значит, не доглядел.;— Тэ ёв о паны то дро прудо пхэрдя, нэ и на додыкхья...;0.6587169766426086;brigada
— Сукин сын!;— Тэ пхадёл тро шэро!;0.64109206199646;brigada
Нутрец седой!..;Джюкэл сыво!..;0.8718197345733643;brigada
Чем же ты нас накормил?! — взвизгнула Аниська, сноха Донецковых, и с подвывом заголосила: — Ить я зараз в тягостях!;Соса жэ ту амэн чярадян!? — задыя годла санэ глосяса Аниська, Донецквовонэнгири бори, и зауиндя: — Эн мэ пхари сом!;0.9301815032958984;brigada
А ежели вот скину через тебя, подлюшного?..;А коли мэ счюрдава пирдал тутэ, джюклэстэ!?;0.6912435293197632;brigada
Да с тем как шарахнет в деда Щукаря кашей из своей миски!;Тэ сыр чюрдэла дрэ пхурэ Шшукарёстэ кхурми сарэ чярэстыр!;0.7873639464378357;brigada
Поднялся великий шум.;Ґаздыяпэ дрэван бари годла.;0.4530227780342102;brigada
Бабы дружно тянулись руками к Щукаревой бороде, невзирая на то, что растерявшийся и перепуганный Щукарь упорно выкрикивал: — Охолоньте трошки!;Джювля сарэ тырдынэпэ вастэнца ко Шшукарёскирэ чёра, на дыкхи прэ одова, со пиритрашадо Шшукарё дыя годла: — Потэрдён, потэрдён!;0.771517276763916;brigada
Это не лягушка!;Адава — на жамба!;0.7392634153366089;brigada
Истинный Христос, не лягушка!;Окэ дэвэл тумэнгэ — нанэ жамба!;0.31157252192497253;brigada
— А что же это? — наседала Аниська Донецкова, страшная в своей злобе.;— А со жэ адава?! — чюрдыяпэ прэ лэстэ Аниська, Донэцкова трашаны дрэ пэскири холы.;0.8915360569953918;brigada
— Это одна видимость вам!;— Адава — адякэ!;0.5215179920196533;brigada
Это вам видение! — пробовал схитрить Щукарь.;Адава сыкадыя тумэнгэ! — фрэнтындя Шшукарё.;0.8624239563941956;brigada
Но обглодать косточку «видимости», предложенную ему Любишкиным, категорически отказался.;Нэ коли лэскэ Любишкино пхэндя, собы ёв обглодындя кокалыцо, Шшукарё отпхэндяпэ.;0.5520795583724976;brigada
Быть может, на том дело и кончилось бы, если бы вконец разозленный бабами Щукарь не крикнул: — Мокрохвостые!;Тэ ґалёв прэ адава и кончиндяпэ бы рэндо, коли бы на розхолякирдо джювленца Шшукарё на задыя годла: — Нэ киндэ порья!;0.7922559380531311;brigada
Сатаны в юбках!;Бэнга дро индараки!;0.6443066596984863;brigada
До морды тянетесь, а того не понимаете, что это не простая лягушка, а вустрица!;Ко муй о васта протырдэна, а одова на полэна, со адава на просто жамба, а э вустрица!;0.749587893486023;brigada
— Кто-о-о-о?! — изумились бабы.;— К-о-он?! — выпурадэ якха джювля.;0.8816216588020325;brigada
— Вустрица, русским языком вам говорю!;— Вустрица, русконэ чибаса тумэнгэ ракирава!;0.8792309761047363;brigada
Лягушка — мразь, а в вустрице благородные кровя!;Жамба — адава блата, а вустрица адава вавир рэндо!;0.8382777571678162;brigada
Мой родный кум при старом прижиме у самого генерала Филимонова в денщиках служил и рассказывал, что генерал их даже натощак сотнями заглатывал!;Миро кириво дро пхуранэ бэрша кокорэстэ генералостэ Филимоновонэстэ дро деньшшыкэ джиндя и роспхэндя, со генерало шэлэнца лэн заглотынэлас!;0.820872962474823;brigada
Ел прямо на кореню!;Эн сыр халас!;0.5734910368919373;brigada
Вустрица ишо из ракушки не вылупится, а он уж ее оттель вилочкой позывает.;Вустрица инкэ ракушкатыр на выгыя, а ёв ла одотхыр ужэ вилкицаса вытырдэла.;0.9152253270149231;brigada
Проткнет наскрозь и — ваших нету!;Пропусавэла ла и — тумарэн нанэ бутыр!;0.8116025328636169;brigada
Она жалобно пишшит, а он, знай, ее в горловину пропихивает.;Ёй пишшынэ, а ёв, ла дро кирло замарла.;0.7506771683692932;brigada
А почему вы знаете, может, она, эта хреновина, вустричной породы?;А катыр тумэ джинэн, могискирла тэ явэл, со ёй, адая коя сы вустричнонэ породатыр?;0.76075679063797;brigada
Генералы одобряли, и я, может, нарошно для навару вам, дуракам, положил ее, для скусу…;О генералы ханэ, и мэ, могискирла тэ явэл, пофроми вашо наваро тумэнгэ, дылынэнгэ, чюдём ла, вашо вкусо...;0.7341844439506531;brigada
Тут уж Любишкин не выдержал: ухватив в руку медный половник, он привстал, гаркнул во всю глотку: — Генералы?;Адай уж Любишкино на вырикирдя: ухтылдя дро васта медно половнико, приустя, и задыя годла дро саро кирло: — Генералэ?;0.9228545427322388;brigada
Для навару!..;Ваш наваро?..;0.5457001328468323;brigada
Я красный партизан, а ты меня лягушатиной, как какого-нибудь с… генерала… кормить?!;Мэ лоло партизано, а ту ман жамбитконэ масэса, сыр савэ-то... генералос... тэ чяравэс?!;0.8799117803573608;brigada
Щукарю показалось, что в руках у Любишкина нож, и он со всех ног, не оглядываясь, кинулся бежать…;Шшукарёскэ сыкадыя, со дро васта Любишкиностэ чюри, и ёв сарэ ґэрэндыр, на обдыкхипэ палэ, чюрдыяпэ тэ прастал...;0.8858829140663147;brigada
Давыдов обо всем этом узнал, приехав на стан, а пока, проводив Щукаря, попросил Размётнова погонять — и вскоре подъехал к стану бригады.;Давыдово ваш адава уґалыя, коли явья дро стано, а отэнчя, коли отгыя лэндыр Шшукарё, помангья Размётновонэс тэ подтрадэл — и сыго подгыя ко бригадакиро стано.;0.8045756816864014;brigada
Дождь все еще звенел над степью.;Брышынд уса инке на пириачья.;0.3031608760356903;brigada
От Гремячего Лога до дальнего пруда, в полнеба, стала горбатая, цветастая радуга.;Гремячёнэ логостыр жыко дуратуно прудо, дро паш полыбэ тэрдыя збандькирды гожо радуга.;0.6799956560134888;brigada
На стану не было ни души.;Про стано на сыс ни екх ди.;0.8617056012153625;brigada
Попрощавшись с Размётновым, Давыдов пошел к ближайшей клетке пахоты.;Размётново рискирдя палэ, а Давыдово гыя кэ пашылатуны пахотакири клетка.;0.8007165789604187;brigada
Около нее на попасе ходили выпряженные быки, а плугатарь — Аким Бесхлебнов, — ленясь идти на стан, лег на борозде, укрылся с головой зипуном и придремал под шепелявый говор дождевой капели.;Пашыл латэ прэ попасо псирдэ выдынэ андрэ гурува, а плугатарё — Акимо Бесхлебново, — на заками тэ джял про стано, пасия прэ борозда, учякирдя шэро зипуноса и засутя тэло брышындэскиро ракирибэ.;0.9017167091369629;brigada
Давыдов разбудил его: — Почему не пашешь?;Давыдово розджянгадя лэс: — Состыр на пахинэса?;0.5551401972770691;brigada
Аким нехотя встал, зевнул, улыбнулся.;Акимо наками устя, потырдыяпэ, засандяпэ.;-0.035051967948675156;brigada
— При дожде нельзя пахать, товарищ Давыдов.;— Дро брышын нашты тэ пахинэс, товаришшё Давыдово.;0.6570314168930054;brigada
Вам про это неизвестно?;Тумэ ваш адава на джинэн?;0.8153825402259827;brigada
Бык — не трактор.;Гурув — нанэ тракторо.;0.8833550214767456;brigada
Как толечко намокнет у него шерсть на шее — враз ярмом потрешь шею до крови, и тогда уж на нем отработался.;Сыр только киндёла лэстэ о бал прэ мэн, — екхатыр ярмоса протриинэса мэн жыко рат, и отэнчя ужэ прэ лэстэ отбутякирдянпэ.;0.4373454451560974;brigada
Верно, верно! — закончил он, приметив недоверчивость во взгляде Давыдова, и посоветовал: — Вы бы лучше пошли аников-воинов развели.;Чячё, чячё! — доракирдя ёв, удыкхи дро Давыдовонэскирэ якха напатыв кэ пэскирэ лава, и пхэндя: Тумэ бы фэдыр тэ джян марибнаскирэн тэ розлыджян.;0.8579660654067993;brigada
С утра Кондрат Майданников к Атаманчукову присыкается…;Злокостыр Кондрато Майданниково ко Атаманчюково приячела...;0.9001739621162415;brigada
А зараз вон у них стражение идет на энтой клетке.;А акана лэндэ кошыбэ джяла эн прэ одоя клетка.;0.8024969696998596;brigada
