to;from;sim;source
Потом почесался, подумал и прибавил: «Константину Макарычу».;"Отэнчя похарудяпэ подуминдя и причиндя инкэ „Константин Макарычёскэ"".";0.8334012031555176;vanka
Довольный тем, что ему не помешали писать, он надел шапку и, не набрасывая на себя шубейки, прямо в рубахе выбежал на улицу...;Лэскэ удыяпэ тэ чинэл лыл и адалэстыр сыс мишто про ило, ёв уридя стады и би постынэскиро дрэ екх гад выухтя прэ гаса...;0.7176048159599304;vanka
Сидельцы из мясной лавки, которых он расспрашивал накануне, сказали ему, что письма опускаются в почтовые ящики, а из ящиков развозятся по всей земле на почтовых тройках с пьяными ямщиками и звонкими колокольцами.;Дрэ банза мануша, савэн ёв роспучья пхэндлэ лэскэ, со лыла змэкэнапэ дрэ почтова яшшики, а яшшикэндыр розлыджянапэ пирэ сари пхув прэ почтовонэ грэндэ э матэ шоляренца.;0.5742784738540649;vanka
Ванька добежал до первого почтового ящика и сунул драгоценное письмо в щель...;Ванька допрастандыя жыко пэрво почтово яшшико и змэкья дрого лыл дро яшшыко.;0.6942269802093506;vanka
Убаюканный сладкими надеждами, он час спустя крепко спал...;Промэки мардо ёв зоралэс засутя гудлэ надеяса...;0.6482349634170532;vanka
Ему снилась печка.;Лэскэ дыкхьяпэ дро сунэ бов.;0.48900264501571655;vanka
На печи сидит дед, свесив босые ноги, и читает письмо кухаркам...;Ванька стходя лыл и втходя лэс дро конверто, саво киндя инкэ атася палэ ґасприн...;0.5476806163787842;vanka
Около печи ходит Вьюн и вертит хвостом...;Пашыл бов псирла Вьюно и крэнцынэла порьяса...;0.8432941436767578;vanka